{
  "$schema": "../scenario-schema.json",
  "scenario": {
    "id": "case-001",
    "title": "Тишина на Мэдисон",
    "city": "Сиэтл, штат Вашингтон",
    "year": 2026,
    "duration": "90–120 минут",
    "players": "1–6 игроков",
    "difficulty": "Средняя",
    "premise": "Вечером в понедельник шестнадцатилетняя Майя Беннетт не вернулась домой после школьного занятия. Телефон выключен, добровольный уход из дома не похож на неё. Через сорок минут после заявления о пропаже следователи получают первое странное сообщение: кто-то видел автомобиль, который несколько раз проезжал возле школы, но никто не запомнил номер целиком.",
    "opening": "Это не история о гениальном преступнике. Здесь нет тайного общества и случайной мистики. Есть обычный город, десятки людей, которые видели только маленькие фрагменты происходящего, и одна ночь, которую нужно восстановить по минутам."
  },
  "mapTemplateId": "small_town",
  "characters": [
    {
      "id": "maya",
      "name": "Майя Беннетт",
      "age": 16,
      "role": "ученица Lincoln High School",
      "relation": "Пропавшая",
      "summary": "Спокойная, внимательная к деталям, занимается фотографией и подрабатывает в фотолаборатории по субботам.",
      "quote": "«Я буду дома до девяти. Не волнуйся.»",
      "portrait": "portraits/maya.jpg",
      "status": "missing"
    },
    {
      "id": "elena",
      "name": "Елена Беннетт",
      "age": 42,
      "role": "мать Майи, бухгалтер",
      "relation": "Мать пропавшей",
      "summary": "Звонила дочери в 20:51 и первой заявила о пропаже. Настаивает, что Майя не стала бы исчезать добровольно.",
      "quote": "«Она может спорить со мной, но никогда не оставляет телефон выключенным.»",
      "portrait": "portraits/elena.jpg",
      "locationId": "bennett_home",
      "status": "witness"
    },
    {
      "id": "daniel",
      "name": "Дэниел Кроу",
      "age": 39,
      "role": "учитель фотографии",
      "relation": "Преподаватель Майи",
      "summary": "Последним видел Майю после школьного фотокружка. Утверждает, что она ушла одна.",
      "quote": "«Она торопилась. Сказала, что ей нужно кое-что забрать.»",
      "portrait": "portraits/daniel.jpg",
      "locationId": "lincoln_school",
      "status": "witness"
    },
    {
      "id": "nora",
      "name": "Нора Вэйл",
      "age": 27,
      "role": "администратор фотолаборатории",
      "relation": "Работодатель Майи",
      "summary": "Майя часто оставляла у неё пленку и старые камеры. Нора знала о последнем заказе Майи.",
      "quote": "«Она спрашивала, можно ли распечатать снимки без записи в журнале.»",
      "portrait": "portraits/nora.jpg",
      "locationId": "rainier_lab",
      "status": "witness"
    },
    {
      "id": "marcus",
      "name": "Маркус Хилл",
      "age": 31,
      "role": "водитель службы доставки",
      "relation": "Случайный свидетель",
      "summary": "Вёз заказ по Мэдисон-стрит и заметил девушку возле серого фургона.",
      "quote": "«Я не уверен, что это была она. Но рюкзак точно был такой же.»",
      "portrait": "portraits/marcus.jpg",
      "locationId": "madison_market",
      "status": "witness"
    },
    {
      "id": "june",
      "name": "Джун Пак",
      "age": 17,
      "role": "одноклассница Майи",
      "relation": "Подруга",
      "summary": "Переписывалась с Майей до исчезновения. Сначала скрывает часть переписки, опасаясь наказания родителей.",
      "quote": "«Она сказала, что нашла доказательство. Я решила, что она драматизирует.»",
      "portrait": "portraits/june.jpg",
      "locationId": "lincoln_school",
      "status": "witness"
    },
    {
      "id": "sam",
      "name": "Сэмюэл Рид",
      "age": 45,
      "role": "владелец автомастерской",
      "relation": "Знакомый семьи",
      "summary": "Живёт и работает неподалёку от маршрута Майи. Его камера смотрит на переулок.",
      "quote": "«Камера старая. Если хотите запись — ищите конкретный промежуток.»",
      "portrait": "portraits/sam.jpg",
      "locationId": "reed_garage",
      "status": "witness"
    },
    {
      "id": "leah",
      "name": "Лия Моррис",
      "age": 34,
      "role": "журналистка местной газеты",
      "relation": "Источник Майи",
      "summary": "Получала от Майи фотографии, которые та считала важными. Не сразу говорит, откуда они.",
      "quote": "«Я обещала не публиковать это, пока не проверю второй источник.»",
      "portrait": "portraits/leah.jpg",
      "locationId": "city_news",
      "status": "suspect"
    }
  ],
  "clues": [
    {
      "id": "clue_phone",
      "title": "Телефон Майи",
      "type": "предмет",
      "description": "Телефон найден дома, хотя мать ожидала, что Майя заберёт его с собой.",
      "detail": "На 20:48 пришло сообщение от неизвестного номера: «Не поезжай одна. Встретимся там, где ты снимала окна». Через три минуты сообщение удалено с устройства, но сохранилось в резервной копии.",
      "locationId": "bennett_home",
      "importance": "critical",
      "relatedCharacters": ["maya", "elena"],
      "relatedClues": ["clue_photo"],
      "foundWhen": "Осмотр спальни Майи"
    },
    {
      "id": "clue_photo",
      "title": "Контактный лист с окнами",
      "type": "фотография",
      "description": "Шесть кадров одного здания, снятых с противоположной стороны улицы.",
      "detail": "На двух кадрах виден служебный вход старого здания на 14th Ave. На третьем — серый фургон без читаемого номера. В углу каждого кадра стоит время съёмки.",
      "locationId": "bennett_home",
      "importance": "critical",
      "relatedCharacters": ["maya", "leah"],
      "relatedClues": ["clue_van"],
      "foundWhen": "Папка «MAY_14» на столе"
    },
    {
      "id": "clue_attendance",
      "title": "Журнал фотокружка",
      "type": "документ",
      "description": "Майя отметилась на занятии в 18:02 и ушла позже остальных.",
      "detail": "Дэниел Кроу записал, что Майя задержалась до 20:14. Но автоматическая карта доступа школы показывает выход в 20:07.",
      "locationId": "lincoln_school",
      "importance": "important",
      "relatedCharacters": ["maya", "daniel"],
      "relatedClues": ["clue_camera"],
      "foundWhen": "Административная система школы"
    },
    {
      "id": "clue_june_chat",
      "title": "Переписка Джун",
      "type": "сообщения",
      "description": "Джун показывает последние сообщения с Майей.",
      "detail": "В 19:52 Майя пишет: «Я поняла, кто подменял номера на коробках». В 20:03: «Если я не отвечу, отправь Лии снимки».",
      "locationId": "lincoln_school",
      "importance": "critical",
      "relatedCharacters": ["maya", "june", "leah"],
      "relatedClues": ["clue_boxes"],
      "foundWhen": "Телефон Джун"
    },
    {
      "id": "clue_boxes",
      "title": "Фотографии коробок",
      "type": "фотография",
      "description": "На снимках видны паллеты с одинаковыми белыми коробками.",
      "detail": "На коробках виден частично заклеенный код «RB-14». Такой же код встречается в журнале поставок одной из компаний на Мэдисон-стрит.",
      "locationId": "rainier_lab",
      "importance": "important",
      "relatedCharacters": ["maya", "nora"],
      "relatedClues": ["clue_manifest"],
      "foundWhen": "Компьютер фотолаборатории"
    },
    {
      "id": "clue_manifest",
      "title": "Накладная RB-14",
      "type": "документ",
      "description": "Старая копия накладной на партию оборудования.",
      "detail": "Груз прибыл на склад временного хранения два дня назад. Получатель указан как «Northline Storage», но подпись в журнале не совпадает с образцом подписи менеджера.",
      "locationId": "madison_market",
      "importance": "critical",
      "relatedCharacters": ["leah", "sam"],
      "relatedClues": ["clue_camera", "clue_van"],
      "foundWhen": "Книга поставок"
    },
    {
      "id": "clue_van",
      "title": "Серый фургон",
      "type": "наблюдение",
      "description": "Свидетель видел серый Ford Transit рядом с остановкой.",
      "detail": "Маркус запомнил наклейку в виде маленького белого треугольника на задней двери. Позже такой же знак виден на фотографии Майи.",
      "locationId": "madison_market",
      "importance": "important",
      "relatedCharacters": ["marcus", "maya"],
      "relatedClues": ["clue_photo"],
      "foundWhen": "Разговор с Маркусом"
    },
    {
      "id": "clue_camera",
      "title": "Запись камеры мастерской",
      "type": "видео",
      "description": "Камера Сэма смотрит на переулок за мастерской.",
      "detail": "В 20:19 в кадре появляется серый фургон. В 20:22 из него выходит человек в тёмной куртке. Лицо не видно. В 20:27 фургон уезжает в сторону I-90.",
      "locationId": "reed_garage",
      "importance": "critical",
      "relatedCharacters": ["sam", "maya"],
      "relatedClues": ["clue_van", "clue_route"],
      "foundWhen": "Архив камеры за 20:00–20:40"
    },
    {
      "id": "clue_route",
      "title": "Маршрут до склада",
      "type": "карта",
      "description": "Сопоставление времени камеры и дорожной обстановки.",
      "detail": "Из переулка фургон физически мог добраться до Northline Storage за 8–11 минут. Другой путь занял бы минимум 20 минут.",
      "locationId": "reed_garage",
      "importance": "important",
      "relatedCharacters": ["sam"],
      "relatedClues": ["clue_manifest"],
      "foundWhen": "Сопоставление времени"
    },
    {
      "id": "clue_news",
      "title": "Конверт Лии",
      "type": "документ",
      "description": "В конверте — две фотографии и распечатка реестра.",
      "detail": "Лия признаётся, что Майя передала ей материалы по подмене серийных номеров на оборудовании. Она не публиковала их, потому что хотела проверить источник.",
      "locationId": "city_news",
      "importance": "critical",
      "relatedCharacters": ["leah", "maya"],
      "relatedClues": ["clue_manifest"],
      "foundWhen": "Разговор с Лией"
    },
    {
      "id": "clue_storage",
      "title": "Запись доступа Northline",
      "type": "журнал",